{
  "schema": "telemetry/v1",
  "node_id": "11111111-1111-4111-8111-111111111111",
  "instance_id": "22222222-2222-4222-8222-222222222222",
  "observed_at": "2026-08-27T09:00:00Z",
  "uptime_seconds": 86400,
  "load": {
    "load1": 0.12,
    "load5": 0.08,
    "load15": 0.05
  },
  "memory": {
    "total_bytes": 2147483648,
    "used_bytes": 1073741824
  },
  "filesystem": {
    "mount": "/",
    "total_bytes": 53687091200,
    "used_bytes": 10737418240
  },
  "network": {
    "rx_bytes": 1048576000,
    "tx_bytes": 524288000
  },
  "sing_box": {
    "active": true,
    "connection_count": 42,
    "restart_count": 1,
    "last_restart_at": "2026-08-26T12:00:00Z"
  },
  "accountd": {
    "active": true,
    "last_poll_age_seconds": 15,
    "export_seq": 128,
    "last_event_age_seconds": 20
  }
}
